{
  "$schema": "./models_registry.schema.json",
  "version": "1.0.0",
  "last_updated": "2025-10-22T22:05:19Z",
  "categories": {
    "text-llm": {
      "name": "Text-Only Language Models",
      "description": "Models for text generation and completion tasks",
      "icon": "\u270d\ufe0f"
    },
    "vision-vlm": {
      "name": "Vision-Language Models",
      "description": "Multimodal models for image + text understanding",
      "icon": "\ud83c\udfa8"
    }
  },
  "models": {
    "unsloth/tinyllama-bnb-4bit": {
      "id": "unsloth/tinyllama-bnb-4bit",
      "name": "TinyLlama 1.1B (4-bit)",
      "category": "text-llm",
      "provider": "unsloth",
      "base_architecture": "llama",
      "parameters": "1.1B",
      "description": "Compact model perfect for testing and low-memory environments",
      "tags": [
        "small",
        "fast",
        "testing",
        "quantized"
      ],
      "status": "stable",
      "quantization": {
        "method": "4bit",
        "type": "bitsandbytes"
      },
      "requirements": {
        "min_vram_gb": 4,
        "recommended_vram_gb": 6,
        "min_ram_gb": 8,
        "cuda_compute_capability": "7.0"
      },
      "capabilities": {
        "training": true,
        "inference": true,
        "vision": false,
        "structured_outputs": true,
        "streaming": true,
        "function_calling": false
      },
      "training_defaults": {
        "hyperparameters": {
          "learning_rate": 0.00002,
          "num_epochs": 3,
          "batch_size": 2,
          "gradient_accumulation_steps": 4,
          "warmup_steps": 10,
          "max_seq_length": 2048,
          "optim": "adamw_8bit",
          "lr_scheduler_type": "linear"
        },
        "lora_config": {
          "r": 16,
          "lora_alpha": 16,
          "lora_dropout": 0.0,
          "target_modules": [
            "q_proj",
            "k_proj",
            "v_proj",
            "o_proj"
          ],
          "use_rslora": false
        }
      },
      "inference_defaults": {
        "max_model_len": 2048,
        "dtype": "auto",
        "gpu_memory_utilization": 0.0,
        "quantization": null,
        "tensor_parallel_size": 1
      },
      "urls": {
        "huggingface": "https://huggingface.co/unsloth/tinyllama-bnb-4bit",
        "docs": null
      }
    },
    "unsloth/phi-2-bnb-4bit": {
      "id": "unsloth/phi-2-bnb-4bit",
      "name": "Phi-2 2.7B (4-bit)",
      "category": "text-llm",
      "provider": "unsloth",
      "base_architecture": "phi",
      "parameters": "2.7B",
      "description": "Microsoft's Phi-2 with excellent quality-to-size ratio",
      "tags": [
        "medium",
        "quality",
        "efficient",
        "quantized"
      ],
      "status": "stable",
      "quantization": {
        "method": "4bit",
        "type": "bitsandbytes"
      },
      "requirements": {
        "min_vram_gb": 6,
        "recommended_vram_gb": 8,
        "min_ram_gb": 16,
        "cuda_compute_capability": "7.0"
      },
      "capabilities": {
        "training": true,
        "inference": true,
        "vision": false,
        "structured_outputs": true,
        "streaming": true,
        "function_calling": false
      },
      "training_defaults": {
        "hyperparameters": {
          "learning_rate": 0.00002,
          "num_epochs": 3,
          "batch_size": 2,
          "gradient_accumulation_steps": 4,
          "warmup_steps": 10,
          "max_seq_length": 2048,
          "optim": "adamw_8bit",
          "lr_scheduler_type": "linear"
        },
        "lora_config": {
          "r": 16,
          "lora_alpha": 16,
          "lora_dropout": 0.0,
          "target_modules": [
            "q_proj",
            "k_proj",
            "v_proj",
            "dense"
          ],
          "use_rslora": false
        }
      },
      "inference_defaults": {
        "max_model_len": 2048,
        "dtype": "auto",
        "gpu_memory_utilization": 0.0,
        "quantization": null,
        "tensor_parallel_size": 1
      },
      "urls": {
        "huggingface": "https://huggingface.co/unsloth/phi-2-bnb-4bit",
        "docs": null
      }
    },
    "unsloth/mistral-7b-bnb-4bit": {
      "id": "unsloth/mistral-7b-bnb-4bit",
      "name": "Mistral 7B (4-bit)",
      "category": "text-llm",
      "provider": "unsloth",
      "base_architecture": "mistral",
      "parameters": "7B",
      "description": "High-quality 7B model with excellent performance",
      "tags": [
        "large",
        "high-quality",
        "popular",
        "quantized"
      ],
      "status": "stable",
      "quantization": {
        "method": "4bit",
        "type": "bitsandbytes"
      },
      "requirements": {
        "min_vram_gb": 8,
        "recommended_vram_gb": 12,
        "min_ram_gb": 16,
        "cuda_compute_capability": "7.0"
      },
      "capabilities": {
        "training": true,
        "inference": true,
        "vision": false,
        "structured_outputs": true,
        "streaming": true,
        "function_calling": false
      },
      "training_defaults": {
        "hyperparameters": {
          "learning_rate": 0.00002,
          "num_epochs": 3,
          "batch_size": 2,
          "gradient_accumulation_steps": 4,
          "warmup_steps": 10,
          "max_seq_length": 4096,
          "optim": "adamw_8bit",
          "lr_scheduler_type": "linear"
        },
        "lora_config": {
          "r": 16,
          "lora_alpha": 16,
          "lora_dropout": 0.0,
          "target_modules": [
            "q_proj",
            "k_proj",
            "v_proj",
            "o_proj"
          ],
          "use_rslora": false
        }
      },
      "inference_defaults": {
        "max_model_len": 4096,
        "dtype": "auto",
        "gpu_memory_utilization": 0.0,
        "quantization": null,
        "tensor_parallel_size": 1
      },
      "urls": {
        "huggingface": "https://huggingface.co/unsloth/mistral-7b-bnb-4bit",
        "docs": null
      }
    },
    "unsloth/llama-2-7b-bnb-4bit": {
      "id": "unsloth/llama-2-7b-bnb-4bit",
      "name": "Llama 2 7B (4-bit)",
      "category": "text-llm",
      "provider": "unsloth",
      "base_architecture": "llama",
      "parameters": "7B",
      "description": "Meta's Llama 2 - popular and well-tested",
      "tags": [
        "large",
        "popular",
        "tested",
        "quantized"
      ],
      "status": "stable",
      "quantization": {
        "method": "4bit",
        "type": "bitsandbytes"
      },
      "requirements": {
        "min_vram_gb": 8,
        "recommended_vram_gb": 12,
        "min_ram_gb": 16,
        "cuda_compute_capability": "7.0"
      },
      "capabilities": {
        "training": true,
        "inference": true,
        "vision": false,
        "structured_outputs": true,
        "streaming": true,
        "function_calling": false
      },
      "training_defaults": {
        "hyperparameters": {
          "learning_rate": 0.00002,
          "num_epochs": 3,
          "batch_size": 2,
          "gradient_accumulation_steps": 4,
          "warmup_steps": 10,
          "max_seq_length": 4096,
          "optim": "adamw_8bit",
          "lr_scheduler_type": "linear"
        },
        "lora_config": {
          "r": 16,
          "lora_alpha": 16,
          "lora_dropout": 0.0,
          "target_modules": [
            "q_proj",
            "k_proj",
            "v_proj",
            "o_proj"
          ],
          "use_rslora": false
        }
      },
      "inference_defaults": {
        "max_model_len": 4096,
        "dtype": "auto",
        "gpu_memory_utilization": 0.0,
        "quantization": null,
        "tensor_parallel_size": 1
      },
      "urls": {
        "huggingface": "https://huggingface.co/unsloth/llama-2-7b-bnb-4bit",
        "docs": null
      }
    },
    "unsloth/llama-3-8b-bnb-4bit": {
      "id": "unsloth/llama-3-8b-bnb-4bit",
      "name": "Llama 3 8B (4-bit)",
      "category": "text-llm",
      "provider": "unsloth",
      "base_architecture": "llama",
      "parameters": "8B",
      "description": "Latest Llama 3 with improved performance",
      "tags": [
        "large",
        "latest",
        "high-quality",
        "quantized"
      ],
      "status": "stable",
      "quantization": {
        "method": "4bit",
        "type": "bitsandbytes"
      },
      "requirements": {
        "min_vram_gb": 10,
        "recommended_vram_gb": 14,
        "min_ram_gb": 16,
        "cuda_compute_capability": "7.0"
      },
      "capabilities": {
        "training": true,
        "inference": true,
        "vision": false,
        "structured_outputs": true,
        "streaming": true,
        "function_calling": false
      },
      "training_defaults": {
        "hyperparameters": {
          "learning_rate": 0.00002,
          "num_epochs": 3,
          "batch_size": 2,
          "gradient_accumulation_steps": 4,
          "warmup_steps": 10,
          "max_seq_length": 8192,
          "optim": "adamw_8bit",
          "lr_scheduler_type": "linear"
        },
        "lora_config": {
          "r": 16,
          "lora_alpha": 16,
          "lora_dropout": 0.0,
          "target_modules": [
            "q_proj",
            "k_proj",
            "v_proj",
            "o_proj"
          ],
          "use_rslora": false
        }
      },
      "inference_defaults": {
        "max_model_len": 8192,
        "dtype": "auto",
        "gpu_memory_utilization": 0.0,
        "quantization": null,
        "tensor_parallel_size": 1
      },
      "urls": {
        "huggingface": "https://huggingface.co/unsloth/llama-3-8b-bnb-4bit",
        "docs": null
      }
    },
    "Qwen/Qwen2.5-VL-3B-Instruct": {
      "id": "Qwen/Qwen2.5-VL-3B-Instruct",
      "name": "Qwen2.5-VL 3B Instruct",
      "category": "vision-vlm",
      "provider": "qwen",
      "base_architecture": "qwen-vl",
      "parameters": "3B",